{"identity":{"classification_id":"synthetic.slots.001","status":"structural_slots_pending_review"},"integrity":{"hash_algorithm":"sha256","slots_sha256":"c30eddd2d7e4fc5e16916774052d44b705ad5472755de968ea61aab28bab3a67"},"schema_version":"0.1","slots":[{"max_characters":8,"slot_id":"slot.path_01","tags":["article","div","div","div","div","div"],"text_nodes":12,"total_characters":60},{"max_characters":1,"slot_id":"slot.path_02","tags":["article","div","div","div","div","div","div","div","div"],"text_nodes":12,"total_characters":12},{"max_characters":30,"slot_id":"slot.path_03","tags":["article","div","div","div","div","p"],"text_nodes":12,"total_characters":240}],"source":{"topology_report_id":"synthetic.topology.001","topology_report_sha256":"9deb26dec8972288a831872a9fac024ca657eb8c0b080f7f2b52744a902f041c"}}
